We're attempting to reverse engineer the interface for the MAKStripe. It does
not include specifications and the manufacturer has not returned our emails.

This is the output of `dmesg` on Debian Gnu/Linux for the MAKStripe USB device:
[516281.960098] usb 5-2: new full speed USB device using uhci_hcd and address 8
[516282.121155] usb 5-2: New USB device found, idVendor=10c4, idProduct=ea60
[516282.121158] usb 5-2: New USB device strings: Mfr=1, Product=2, SerialNumber=3
[516282.121160] usb 5-2: Product: CP2102 USB to UART Bridge Controller
[516282.121161] usb 5-2: Manufacturer: Silicon Labs
[516282.121163] usb 5-2: SerialNumber: 0001
[516282.121240] usb 5-2: configuration #1 chosen from 1 choice
[516282.127185] cp2101 5-2:1.0: cp2101 converter detected
[516282.240090] usb 5-2: reset full speed USB device using uhci_hcd and address 8
[516282.446301] usb 5-2: cp2101 converter now attached to ttyUSB0

This is the output of `lsusb` on the same system:
Bus 005 Device 007: ID 10c4:ea60 Cygnal Integrated Products, Inc. CP210x Composite Device

Please see the makstripe.h for the current list of known magic bytes and their
possible meanings.

To gather further codes, it is helpful to sniff the USB bus. This process is
outlined in the following url:

	http://biot.com/blog/usb-sniffing-on-linux

This is an ongoing effort, if you would like to help, please email us!

To sniff the USB bus with the above configuration (USB bus device 5, etc):

	mount -t debugfs none_debugs /sys/kernel/debug
	modprobe usbmon
	cat /sys/kernel/debug/usbmon/5u > /tmp/MAKStripe-capture-000

Here are some additional sniffed commands captured with that method that need
decoding:

FORMAT command with a duration of 66 seconds with track 1 slected:
f688cbc0 1279518494 S Bo:5:009:1 -115 4 = 46011064
f688cbc0 1279519708 C Bo:5:009:1 0 4 >
f688cc40 1279521706 C Bi:5:009:1 0 3 = 464d20
f688cc40 1279521711 S Bi:5:009:1 -115 64 <

f688cc40 1282019739 C Bi:5:009:1 0 5 = 464d3d4f 4b
f688cc40 1282019748 S Bi:5:009:1 -115 64 <

FORMAT command with a duration of 1 second with track 1 selected:
f688cbc0 1308562309 S Bo:5:009:1 -115 4 = 46010864
f688cbc0 1308563713 C Bo:5:009:1 0 4 >
f688cc40 1308565710 C Bi:5:009:1 0 3 = 464d20
f688cc40 1308565716 S Bi:5:009:1 -115 64 <

f688cc40 1309815755 C Bi:5:009:1 0 5 = 464d3d4f 4b
f688cc40 1309815763 S Bi:5:009:1 -115 64 <

FORMAT command with a duration of 66 seconds with tracks 1 and 2 selected:

f688cbc0 542770565 S Bo:5:009:1 -115 4 = 46031064
f688cbc0 542771652 C Bo:5:009:1 0 4 >
f688cc40 542773612 C Bi:5:009:1 0 3 = 464d20
f688cc40 542773618 S Bi:5:009:1 -115 64 <

f688cc40 545271654 C Bi:5:009:1 0 5 = 464d3d4f 4b
f688cc40 545271664 S Bi:5:009:1 -115 64 <

FORMAT command with a duration of 66 seconds with track 2 selected:

f688cbc0 2641417750 S Bo:5:009:1 -115 4 = 46040864
f688cbc0 2641419665 C Bo:5:009:1 0 4 >
f688cc40 2641421659 C Bi:5:009:1 0 3 = 464d20
f688cc40 2641421664 S Bi:5:009:1 -115 64 <
f688cc40 2642674676 C Bi:5:009:1 0 5 = 464d3d4f 4b
f688cc40 2642674685 S Bi:5:009:1 -115 64 <

FORMAT command with a duration of 1 seconds with all 3 tracks selected:

f688cbc0 2684789444 S Bo:5:009:1 -115 4 = 46070864
f688cbc0 2684790637 C Bo:5:009:1 0 4 >
f688cc40 2684792635 C Bi:5:009:1 0 3 = 464d20
f688cc40 2684792648 S Bi:5:009:1 -115 64 <

f688cc40 2686043674 C Bi:5:009:1 0 5 = 464d3d4f 4b
f688cc40 2686043685 S Bi:5:009:1 -115 64 <

ERASE command with a duration of 1 second with track 1 selected:


f688cbc0 2739132923 S Bo:5:009:1 -115 3 = 450101
f688cbc0 2739134645 C Bo:5:009:1 0 3 >
f688cc40 2739136642 C Bi:5:009:1 0 3 = 457220
f688cc40 2739136650 S Bi:5:009:1 -115 64 <

f688cc40 2740121681 C Bi:5:009:1 0 5 = 45723d4f 4b
f688cc40 2740121690 S Bi:5:009:1 -115 64 <


ERASE command with a duration of 1 second with track 2 selected:

f688cbc0 2754253377 S Bo:5:009:1 -115 3 = 450201
f688cbc0 2754254675 C Bo:5:009:1 0 3 >
f688cc40 2754256672 C Bi:5:009:1 0 3 = 457220
f688cc40 2754256676 S Bi:5:009:1 -115 64 <

f688cc40 2755243693 C Bi:5:009:1 0 5 = 45723d4f 4b
f688cc40 2755243702 S Bi:5:009:1 -115 64 <

ERASE command with a duration of 1 second with track 3 selected:
f688cbc0 2766170378 S Bo:5:009:1 -115 3 = 450401
f688cbc0 2766171681 C Bo:5:009:1 0 3 >
f688cc40 2766173673 C Bi:5:009:1 0 3 = 457220
f688cc40 2766173677 S Bi:5:009:1 -115 64 <

f688cc40 2767159693 C Bi:5:009:1 0 5 = 45723d4f 4b
f688cc40 2767159708 S Bi:5:009:1 -115 64 <

ERASE command with a duration of 1 second with all tracks selected:
f688cbc0 2788144866 S Bo:5:009:1 -115 3 = 450701
f688cbc0 2788146683 C Bo:5:009:1 0 3 >
f688cc40 2788148648 C Bi:5:009:1 0 3 = 457220
f688cc40 2788148655 S Bi:5:009:1 -115 64 <

f688cc40 2789133694 C Bi:5:009:1 0 5 = 45723d4f 4b
f688cc40 2789133703 S Bi:5:009:1 -115 64 <


ERASE command with a duration of 1 second with all tracks selected (and autoformat enabled):


f688cbc0 3091190022 S Bo:5:009:1 -115 3 = 450701
f688cbc0 3091191690 C Bo:5:009:1 0 3 >
f688cc40 3091193686 C Bi:5:009:1 0 3 = 457220
f688cc40 3091193691 S Bi:5:009:1 -115 64 <

f688cc40 3092178730 C Bi:5:009:1 0 5 = 45723d4f 4b
f688cc40 3092178741 S Bi:5:009:1 -115 64 <


eRase command with a duration of 1 second with all tracks selected(and autoformat enabled):

f688cbc0 3119908178 S Bo:5:009:1 -115 3 = 650701
f688cbc0 3119909692 C Bo:5:009:1 0 3 >
f688cc40 3119911690 C Bi:5:009:1 0 3 = 655220
f688cc40 3119911695 S Bi:5:009:1 -115 64 <

f688cc40 3120898732 C Bi:5:009:1 0 5 = 65523d4f 4b
f688cc40 3120898743 S Bi:5:009:1 -115 64 <

eRase command with a duration of 1 second with all tracks selected (no autoformat):
f688cbc0 3134793352 S Bo:5:009:1 -115 3 = 650701
f688cbc0 3134794729 C Bo:5:009:1 0 3 >
f688cc40 3134796723 C Bi:5:009:1 0 3 = 655220
f688cc40 3134796728 S Bi:5:009:1 -115 64 <

f688cc40 3135782735 C Bi:5:009:1 0 5 = 65523d4f 4b
f688cc40 3135782746 S Bi:5:009:1 -115 64 <
eRase command with a duration of 1 second with track 1 selected:

f688cbc0 3164304323 S Bo:5:009:1 -115 3 = 650101
f688cbc0 3164305703 C Bo:5:009:1 0 3 >
f688cc40 3164307724 C Bi:5:009:1 0 3 = 655220
f688cc40 3164307729 S Bi:5:009:1 -115 64 <

f688cc40 3165294747 C Bi:5:009:1 0 5 = 65523d4f 4b
f688cc40 3165294758 S Bi:5:009:1 -115 64 <

eRase command with a duration of 1 second with track 2 selected:

f688cbc0 3177879807 S Bo:5:009:1 -115 3 = 650201
f688cbc0 3177881700 C Bo:5:009:1 0 3 >
f688cc40 3177883728 C Bi:5:009:1 0 3 = 655220
f688cc40 3177883735 S Bi:5:009:1 -115 64 <

f688cc40 3178870739 C Bi:5:009:1 0 5 = 65523d4f 4b
f688cc40 3178870748 S Bi:5:009:1 -115 64 <

eRase command with a duration of 1 second with track 3 selected:

f688cbc0 3193333809 S Bo:5:009:1 -115 3 = 650401
f688cbc0 3193335734 C Bo:5:009:1 0 3 >
f688cc40 3193337700 C Bi:5:009:1 0 3 = 655220
f688cc40 3193337707 S Bi:5:009:1 -115 64 <

f688cc40 3194324742 C Bi:5:009:1 0 5 = 65523d4f 4b
f688cc40 3194324751 S Bi:5:009:1 -115 64 <


Starting MAKStripeExplorer (possible init routine):

f51d9440 2065720603 S Co:5:009:0 s 41 00 0001 0000 0000 0
f51d9440 2065721838 C Co:5:009:0 0 0
f51d9440 2065721847 S Co:5:009:0 s 41 00 0001 0000 0000 0
f51d9440 2065722838 C Co:5:009:0 0 0
f688cc40 2065722858 S Bi:5:009:1 -115 64 <
f51d9440 2065722863 S Ci:5:009:0 s c1 02 0000 0000 0002 2 <
f51d9440 2065723843 C Ci:5:009:0 0 2 = 6000
f51d9440 2065723871 S Ci:5:009:0 s c1 04 0000 0000 0002 2 <
f51d9440 2065724839 C Ci:5:009:0 0 2 = 0208
f51d9440 2065724865 S Ci:5:009:0 s c1 14 0000 0000 0010 16 <
f51d9440 2065725837 C Ci:5:009:0 0 16 = 00000000 00000000 00000000 00000000
f51d9440 2065725861 S Co:5:009:0 s 41 07 0303 0000 0000 0
f51d9440 2065726848 C Co:5:009:0 0 0
f51d9440 2065726867 S Co:5:009:0 s 41 07 0303 0000 0000 0
f51d9440 2065727848 C Co:5:009:0 0 0
f688cbc0 2065727900 S Bo:5:009:1 -115 1 = 3f
f688cbc0 2065728847 C Bo:5:009:1 0 1 >
f688cc40 2065732841 C Bi:5:009:1 0 15 = 4d535553 42204349 2e323730 323039
f688cc40 2065732845 S Bi:5:009:1 -115 64 <

Exiting MAKStripeExplorer (possible shutdown routines):

f688cc40 2136670858 C Bi:5:009:1 -2 0
cc4d04c0 2136670875 S Co:5:009:0 s 41 00 0000 0000 0000 0
cc4d04c0 2136672830 C Co:5:009:0 0 0
cc4d04c0 2136672864 S Co:5:009:0 s 41 00 0000 0000 0000 0
cc4d04c0 2136673814 C Co:5:009:0 0 0

