f688cbc0 2868654520 S Bo:5:009:1 -115 3 = 580346
f688cbc0 2868656051 C Bo:5:009:1 0 3 >
f688cc40 2868658047 C Bi:5:009:1 0 3 = 574220
f688cc40 2868658052 S Bi:5:009:1 -115 64 <
f688cbc0 2868930415 S Bo:5:009:1 -115 64 = 28002802 50055002 50055002 50055002 50055002 50052802 28004f07 4f004f07
f688cbc0 2868931089 C Bo:5:009:1 0 64 >
f688cbc0 2868931113 S Bo:5:009:1 -115 64 = 4f004f07 4f004f07 4f004e07 4e004e07 27002702 4e054e02 4e054e02 4e054e02
f688cbc0 2868932086 C Bo:5:009:1 0 64 >
f688cbc0 2868932103 S Bo:5:009:1 -115 64 = 4d054d02 4d054d02 4d054d02 27052707 4d004d07 4d004d07 4d004d07 4d004d07
f688cbc0 2868933087 C Bo:5:009:1 0 64 >
f688cbc0 2868933114 S Bo:5:009:1 -115 64 = 4c004c07 4c004c07 26002602 4c054c02 4c054c02 4c054c02 4c054c02 26052607
f688cbc0 2868934095 C Bo:5:009:1 0 64 >
f688cbc0 2868934151 S Bo:5:009:1 -115 64 = 4b054b02 4b052502 25004b07 4b004b07 4a004a07 4a004a07 25002502 4a054a02
f688cbc0 2868935087 C Bo:5:009:1 0 64 >
f688cbc0 2868935109 S Bo:5:009:1 -115 64 = 25002502 49054902 49054902 49054902 49054902 25052507 49004907 49004907
f688cbc0 2868936093 C Bo:5:009:1 0 64 >
f688cbc0 2868936150 S Bo:5:009:1 -115 64 = 48004807 48004807 48004807 48004807 48002407 24054802 48054802 48054802
f688cbc0 2868937087 C Bo:5:009:1 0 64 >
f688cbc0 2868937110 S Bo:5:009:1 -115 64 = 47054702 47054702 47054702 23052307 47004707 46004607 46004607 46004607
f688cbc0 2868938091 C Bo:5:009:1 0 64 >
f688cbc0 2868938145 S Bo:5:009:1 -115 64 = 46004607 45004507 23002302 45054502 45054502 45054502 45054502 23052207
f688cbc0 2868939088 C Bo:5:009:1 0 64 >
f688cbc0 2868939111 S Bo:5:009:1 -115 64 = 44054402 22052207 44004407 44004407 44004407 44004407 44004407 22002202
f688cbc0 2868950084 C Bo:5:009:1 0 64 >
f688cbc0 2868950105 S Bo:5:009:1 -115 64 = 43002107 21054302 43054302 43054302 43054302 21052107 43004207 42004207
f688cbc0 2868968083 C Bo:5:009:1 0 64 >
f688cbc0 2868968108 S Bo:5:009:1 -115 64 = 42004207 42004207 42004107 41004107 21002102 41054102 41054102 41054102
f688cbc0 2868987086 C Bo:5:009:1 0 64 >
f688cbc0 2868987144 S Bo:5:009:1 -115 64 = 40054002 40054002 40054002 20052007 40004007 40004007 40004007 40004007
f688cbc0 2869005083 C Bo:5:009:1 0 64 >
f688cbc0 2869005109 S Bo:5:009:1 -115 64 = 3f003f07 3f003f07 1f001f02 3f053f02 3f053f02 3f053f02 3f053f02 1f051f07
f688cbc0 2869023084 C Bo:5:009:1 0 64 >
f688cbc0 2869023125 S Bo:5:009:1 -115 64 = 3e053e02 1f051f07 3e003e07 3e003d07 3d003d07 3d003d07 1f001f02 3d053d02
f688cbc0 2869042084 C Bo:5:009:1 0 64 >
f688cbc0 2869042110 S Bo:5:009:1 -115 64 = 1e001e02 3c053c02 3c053c02 3c053c02 3c053c02 3c053c02 1e051e07 3c003c07
f688cbc0 2869060088 C Bo:5:009:1 0 64 >
f688cbc0 2869060145 S Bo:5:009:1 -115 64 = 1e003b07 3b003b07 3b003b07 3b003b07 1d001d02 3b053b02 3b053b02 3b053b02
f688cbc0 2869078092 C Bo:5:009:1 0 64 >
f688cbc0 2869078149 S Bo:5:009:1 -115 64 = 3a053a02 3a053a02 3a053a02 1d051d07 3a003a07 39003907 39003907 39003907
f688cbc0 2869097093 C Bo:5:009:1 0 64 >
f688cbc0 2869097148 S Bo:5:009:1 -115 64 = 39003907 38003807 1c001c02 38053802 38053802 38053802 38053802 1c051c07
f688cbc0 2869115083 C Bo:5:009:1 0 64 >
f688cbc0 2869115110 S Bo:5:009:1 -115 64 = 37053702 37053702 1c051c07 37003707 37003707 37003707 1b001b02 37053702
f688cbc0 2869133083 C Bo:5:009:1 0 64 >
f688cbc0 2869133109 S Bo:5:009:1 -115 64 = 1b001b02 36053602 36053602 36053602 36053602 1b051b07 36003507 35003507
f688cbc0 2869151082 C Bo:5:009:1 0 64 >
f688cbc0 2869151104 S Bo:5:009:1 -115 64 = 35003507 35003507 35003407 34003407 34003407 1a001a02 34053402 34053402
f688cbc0 2869170083 C Bo:5:009:1 0 64 >
f688cbc0 2869170107 S Bo:5:009:1 -115 64 = 33053302 33053302 33053302 1a051a07 33003307 33003307 33003307 33003307
f688cbc0 2869188082 C Bo:5:009:1 0 64 >
f688cbc0 2869188105 S Bo:5:009:1 -115 64 = 32003207 32003207 19001902 32053202 32053202 32053202 32053202 31051902
f688cbc0 2869206084 C Bo:5:009:1 0 64 >
f688cbc0 2869206114 S Bo:5:009:1 -115 64 = 31053102 18051807 31003107 31003007 30003007 30003007 18001802 30053002
f688cbc0 2869225087 C Bo:5:009:1 0 64 >
f688cbc0 2869225110 S Bo:5:009:1 -115 64 = 2f002f07 18001802 2f052f02 2f052f02 2f052f02 18051807 2f002f07 2f002f07
f688cbc0 2869243082 C Bo:5:009:1 0 64 >
f688cbc0 2869243105 S Bo:5:009:1 -115 12 = 2e002e07 2e002e07 2e002e07
f688cbc0 2869261089 C Bo:5:009:1 0 12 >
f688cc40 2869413087 C Bi:5:009:1 0 5 = 57423d4f 4b
f688cc40 2869413095 S Bi:5:009:1 -115 64 <
f688cbc0 2869520271 S Bo:5:009:1 -115 2 = 5707
f688cbc0 2869521051 C Bo:5:009:1 0 2 >
f688cc40 2869523049 C Bi:5:009:1 0 3 = 524120
f688cc40 2869523055 S Bi:5:009:1 -115 64 <
f688cc40 2871872087 C Bi:5:009:1 0 5 = 52413d4f 4b
f688cc40 2871872095 S Bi:5:009:1 -115 64 <
f688cbc0 2872114470 S Bo:5:009:1 -115 2 = 4307
f688cbc0 2872115085 C Bo:5:009:1 0 2 >
f688cc40 2872117082 C Bi:5:009:1 0 3 = 435020
f688cc40 2872117088 S Bi:5:009:1 -115 64 <
f688cc40 2873574094 C Bi:5:009:1 0 5 = 43503d4f 4b
f688cc40 2873574102 S Bi:5:009:1 -115 64 <
f688cbc0 2883327352 S Bo:5:009:1 -115 2 = 5207
f688cbc0 2883329086 C Bo:5:009:1 0 2 >
f688cc40 2883331079 C Bi:5:009:1 0 5 = 52656164 79
f688cc40 2883331084 S Bi:5:009:1 -115 64 <
f688cc40 2887627100 C Bi:5:009:1 0 64 = 52442005 d0120201 0301071b 05010420 0201031f 05010421 02010320 05010421
f688cc40 2887627108 S Bi:5:009:1 -115 64 <
f688cc40 2887643088 C Bi:5:009:1 0 64 = 06210001 01210701 06220001 01210701 06120010 02010321 05010422 02010321
f688cc40 2887643090 S Bi:5:009:1 -115 64 <
f688cc40 2887659094 C Bi:5:009:1 0 64 = 01230701 06230001 01230701 06230001 03210701 06230001 01220701 06130010
f688cc40 2887659097 S Bi:5:009:1 -115 64 <
f688cc40 2887675054 C Bi:5:009:1 0 64 = 02010311 05100701 06220001 01220701 06220001 01220701 06230001 03220701
f688cc40 2887675063 S Bi:5:009:1 -115 64 <
f688cc40 2887692054 C Bi:5:009:1 0 64 = 05010421 0201031f 05010422 02010310 050f0701 061f0001 01200701 061f0001
f688cc40 2887692063 S Bi:5:009:1 -115 64 <
f688cc40 2887708053 C Bi:5:009:1 0 64 = 0201011c 0501041d 0201011b 0501041d 0201011a 0501041b 0201030f 050c0701
f688cc40 2887708062 S Bi:5:009:1 -115 64 <
f688cc40 2887724084 C Bi:5:009:1 0 64 = 060d000e 02010318 05010419 02010319 0501041a 02010318 0501041a 02010118
f688cc40 2887724089 S Bi:5:009:1 -115 64 <
f688cc40 2887741055 C Bi:5:009:1 0 64 = 01170701 06170001 01170701 060b000d 02010316 05010417 02010316 05010417
f688cc40 2887741063 S Bi:5:009:1 -115 64 <
f688cc40 2887757086 C Bi:5:009:1 0 64 = 06160001 01160701 06160001 03150701 06150001 01160701 060b000a 02010315
f688cc40 2887757097 S Bi:5:009:1 -115 64 <
f688cc40 2887773050 C Bi:5:009:1 0 64 = 05090701 06150001 01150701 06140001 01150701 06150001 01150701 06140001
f688cc40 2887773055 S Bi:5:009:1 -115 64 <
f688cc40 2887790084 C Bi:5:009:1 0 64 = 02010312 05010413 0201030c 05070701 04130001 01130701 06120001 01120701
f688cc40 2887790090 S Bi:5:009:1 -115 64 <
f688cc40 2887806091 C Bi:5:009:1 0 64 = 05010411 02010310 0501040f 02010311 05010411 02010311 05010410 00010110
f688cc40 2887806094 S Bi:5:009:1 -115 64 <
f688cc40 2887822091 C Bi:5:009:1 0 64 = 07060501 040e0201 030f0501 040f0201 03100501 040f0201 030e0501 040f0201
f688cc40 2887822094 S Bi:5:009:1 -115 64 <
f688cc40 2887839091 C Bi:5:009:1 0 64 = 060d0001 010f0701 06100001 010f0501 040e0201 030e0501 0401000b 02010301
f688cc40 2887839094 S Bi:5:009:1 -115 64 <
f688cc40 2887855091 C Bi:5:009:1 0 64 = 060d0001 0101050a 0701060d 0001010e 0701060d 0001010d 07010608 00030201
f688cc40 2887855094 S Bi:5:009:1 -115 64 <
f688cc40 2887871091 C Bi:5:009:1 0 64 = 02010301 070a0501 04010002 02060001 010e0701 060c0001 0101050a 0701060e
f688cc40 2887871094 S Bi:5:009:1 -115 64 <
f688cc40 2887888092 C Bi:5:009:1 0 64 = 040d0201 0301070b 05010410 0201030f 0501040f 02010311 0501040f 00010110
f688cc40 2887888095 S Bi:5:009:1 -115 64 <
f688cc40 2887904093 C Bi:5:009:1 0 64 = 02010310 05010411 02010311 05010401 000e0201 03120501 04120201 03120501
f688cc40 2887904096 S Bi:5:009:1 -115 64 <
f688cc40 2887921094 C Bi:5:009:1 0 64 = 01130701 06140001 01010310 07010601 02100001 01150701 06180002 01150501
f688cc40 2887921099 S Bi:5:009:1 -115 64 <
f688cc40 2887937091 C Bi:5:009:1 0 64 = 00010101 05110701 06150001 01160701 06010212 00010101 03110701 06180002
f688cc40 2887937093 S Bi:5:009:1 -115 64 <
f688cc40 2887953093 C Bi:5:009:1 0 64 = 01130501 04170203 03150501 04010013 02010301 01150501 04170001 01180701
f688cc40 2887953096 S Bi:5:009:1 -115 64 <
f688cc40 2887970093 C Bi:5:009:1 0 64 = 0602020c 00070204 03010712 05010419 02010301 01150501 04190206 03160501
f688cc40 2887970096 S Bi:5:009:1 -115 64 <
f688cc40 2887986090 C Bi:5:009:1 0 64 = 00010101 03170701 06010218 00010101 05170701 06010217 0001011d 07010614
f688cc40 2887986093 S Bi:5:009:1 -115 64 <
f688cc40 2888002093 C Bi:5:009:1 0 64 = 00190201 00010118 0501041e 02020301 07150501 041d0201 0301011c 0501041c
f688cc40 2888002097 S Bi:5:009:1 -115 64 <
f688cc40 2888019095 C Bi:5:009:1 0 64 = 00060201 00010117 0501071d 02030301 07160501 04020018 02010301 07190501
f688cc40 2888019098 S Bi:5:009:1 -115 64 <
f688cc40 2888035092 C Bi:5:009:1 0 64 = 061d0001 0101051c 07010301 021c0001 01010518 0701061b 00040101 05150701
f688cc40 2888035095 S Bi:5:009:1 -115 64 <
f688cc40 2888051089 C Bi:5:009:1 0 64 = 01180501 04030017 02010301 071b0501 04010019 02010001 010d050f 0701061a
f688cc40 2888051092 S Bi:5:009:1 -115 64 <
f688cc40 2888068093 C Bi:5:009:1 0 64 = 0701060c 00140201 03010119 0501041b 02010001 01180501 041d0201 0301071a
f688cc40 2888068095 S Bi:5:009:1 -115 64 <
f688cc40 2888084094 C Bi:5:009:1 0 64 = 01200701 0601021b 0001011c 0701061b 0002011c 0701061d 00010120 0701061f
f688cc40 2888084098 S Bi:5:009:1 -115 64 <
f688cc40 2888100094 C Bi:5:009:1 0 64 = 0001011a 05010401 00170201 03140509 0701061e 00010201 031a0701 061c0001
f688cc40 2888100097 S Bi:5:009:1 -115 64 <
f688cc40 2888117093 C Bi:5:009:1 0 64 = 04010017 02010301 07170501 041c0201 00010116 0501071c 02010301 01150501
f688cc40 2888117096 S Bi:5:009:1 -115 64 <
f688cc40 2888133094 C Bi:5:009:1 0 64 = 06190001 011a0701 061c0001 031a0701 060c000d 02010017 05010401 00150201
f688cc40 2888133098 S Bi:5:009:1 -115 64 <
f688cc40 2888149093 C Bi:5:009:1 0 64 = 00150201 030e050a 07010619 00010117 07010618 00010117 07010616 00010118
f688cc40 2888149096 S Bi:5:009:1 -115 64 <
f688cc40 2888166091 C Bi:5:009:1 0 64 = 02010317 05010418 02010318 0501000b 020b0001 01160701 06160001 03160701
f688cc40 2888166094 S Bi:5:009:1 -115 64 <
f688cc40 2888182093 C Bi:5:009:1 0 64 = 05010416 02010316 05010416 02010015 05010615 02010009 050b0701 06130001
f688cc40 2888182097 S Bi:5:009:1 -115 64 <
f688cc40 2888198093 C Bi:5:009:1 0 64 = 02010112 05010414 02010314 05010414 02010314 05010416 02010113 05010715
f688cc40 2888198096 S Bi:5:009:1 -115 64 <
f688cc40 2888214093 C Bi:5:009:1 0 64 = 06130001 01140701 06140001 0109070a 05010714 02010012 05010413 02010313
f688cc40 2888214096 S Bi:5:009:1 -115 64 <
f688cc40 2888231092 C Bi:5:009:1 0 64 = 03110701 06120001 01120701 06120001 01120701 06090009 02010312 05010414
f688cc40 2888231095 S Bi:5:009:1 -115 64 <
f688cc40 2888247091 C Bi:5:009:1 0 64 = 06110001 01120701 06120001 01120701 06120001 01120701 06120001 01120701
f688cc40 2888247094 S Bi:5:009:1 -115 64 <
f688cc40 2888263093 C Bi:5:009:1 0 64 = 05010412 02010311 05010411 02010309 05080701 06120001 01110701 06120001
f688cc40 2888263096 S Bi:5:009:1 -115 64 <
f688cc40 2888280094 C Bi:5:009:1 0 64 = 02010311 05010411 02010311 05010612 02010110 05010607 02090001 03100701
f688cc40 2888280097 S Bi:5:009:1 -115 64 <
f688cc40 2888296095 C Bi:5:009:1 0 64 = 05010412 02010011 05010611 02010012 05010611 02010311 05010411 02010309
f688cc40 2888296099 S Bi:5:009:1 -115 64 <
f688cc40 2888312094 C Bi:5:009:1 0 64 = 02120701 06090008 02010312 05010413 02010012 05010712 02010013 05010611
f688cc40 2888312097 S Bi:5:009:1 -115 64 <
f688cc40 2888329093 C Bi:5:009:1 0 64 = 06130001 01150719 00170718 00160701 010a000a 02010614 05010116 02010013
f688cc40 2888329096 S Bi:5:009:1 -115 64 <
f688cc40 2888345089 C Bi:5:009:1 0 64 = 01120001 04010610 07010301 01100001 04010610 07010301 010f0001 04010613
f688cc40 2888345092 S Bi:5:009:1 -115 64 <
f688cc40 2888361093 C Bi:5:009:1 0 64 = 87ff87ff 87ff87ff 87ff87ff 87ff87ff 87ff87ff 87ff87ff 87ff87ff 87ff87ff
f688cc40 2888361096 S Bi:5:009:1 -115 64 <
f688cc40 2888372086 C Bi:5:009:1 0 42 = 87ff87ff 87ff87ff 87ff87ff 87ff87ff 87ff87ff 87ff87ff 87ff87ff 87ff87ff
f688cc40 2888372090 S Bi:5:009:1 -115 64 <
f688cbc0 2888610940 S Bo:5:009:1 -115 2 = 5207
f688cbc0 2888611054 C Bo:5:009:1 0 2 >
f688cc40 2888614051 C Bi:5:009:1 0 5 = 52656164 79
f688cc40 2888614057 S Bi:5:009:1 -115 64 <
