This is an attempt to write ISO encoded data.
We write three tracks as follows:
%HELLO WORLD I AM TRACK 1?!
%HELLO WORLD I AM TRACK 2?"
%HELLO WORLD I AM TRACK 3?#

We will now copy this data to the hotel card key as expected:

f688cbc0 3275493847 S Bo:5:009:1 -115 3 = 580192
f688cbc0 3275495135 C Bo:5:009:1 0 3 >
f688cc40 3275497117 C Bi:5:009:1 0 3 = 574220
f688cc40 3275497122 S Bi:5:009:1 -115 64 <
f688cbc0 3275767310 S Bo:5:009:1 -115 64 = f000ef07 ef00ef07 ee00ee07 ed00ed07 ed00ec07 ec00eb07 eb00ea07 ea00ea07
f688cbc0 3275768147 C Bo:5:009:1 0 64 >
f688cbc0 3275768175 S Bo:5:009:1 -115 64 = e5077200 72047203 72027205 7207e300 71077103 71047105 71027104 71037106
f688cbc0 3275769146 C Bo:5:009:1 0 64 >
f688cbc0 3275769204 S Bo:5:009:1 -115 64 = de076f00 6f046f03 6e066e01 6e026e05 6e036e04 6e056e02 6e00db07 6d006d04
f688cbc0 3275770139 C Bo:5:009:1 0 64 >
f688cbc0 3275770160 S Bo:5:009:1 -115 64 = 6c016b02 6b056b03 6b046b05 6b026b00 d507d500 d507d400 d4076a00 6a046a03
f688cbc0 3275771144 C Bo:5:009:1 0 64 >
f688cbc0 3275771196 S Bo:5:009:1 -115 64 = 68066801 68066701 67066701 67026705 67036704 67056702 67006607 66036604
f688cbc0 3275772143 C Bo:5:009:1 0 64 >
f688cbc0 3275772197 S Bo:5:009:1 -115 64 = 64016402 64056403 64046405 64026400 c7076300 63046303 63026305 63076300
f688cbc0 3275773139 C Bo:5:009:1 0 64 >
f688cbc0 3275773160 S Bo:5:009:1 -115 64 = 61026105 60076000 60046003 60026005 60036004 60056002 5f00bf07 be00be07
f688cbc0 3275774143 C Bo:5:009:1 0 64 >
f688cbc0 3275774193 S Bo:5:009:1 -115 64 = 5d015d06 5d015c02 5c055c03 5c045c01 5c065c05 5c025c04 5b035b06 5b015b02
f688cbc0 3275775138 C Bo:5:009:1 0 64 >
f688cbc0 3275775159 S Bo:5:009:1 -115 64 = 59055903 59045901 59065905 58025800 58075803 58045805 58025800 58075803
f688cbc0 3275776145 C Bo:5:009:1 0 64 >
f688cbc0 3275776194 S Bo:5:009:1 -115 64 = 56015506 55015506 55015502 55055507 a9005507 54035404 54055402 54045403
f688cbc0 3275787138 C Bo:5:009:1 0 64 >
f688cbc0 3275787192 S Bo:5:009:1 -115 64 = a407a400 a3075200 51045103 51065101 5106a201 51065104 51035007 50005001
f688cbc0 3275805145 C Bo:5:009:1 0 64 >
f688cbc0 3275805198 S Bo:5:009:1 -115 64 = 4e004e04 4e034e06 9c014e06 4e049b03 9b044d03 4d079a00 9a079900 99079800
f688cbc0 3275823134 C Bo:5:009:1 0 64 >
f688cbc0 3275823155 S Bo:5:009:1 -115 36 = 91079100 91079000 90078f00 8f078f00 8e078e00 8d078d00 8d078c00 8c078b00
f688cbc0 3275842142 C Bo:5:009:1 0 36 >
f688cc40 3276001144 C Bi:5:009:1 0 5 = 57423d4f 4b
f688cc40 3276001150 S Bi:5:009:1 -115 64 <
f688cbc0 3276167571 S Bo:5:009:1 -115 2 = 5707
f688cbc0 3276168135 C Bo:5:009:1 0 2 >
f688cc40 3276170129 C Bi:5:009:1 0 3 = 524120
f688cc40 3276170134 S Bi:5:009:1 -115 64 <
f688cc40 3278273145 C Bi:5:009:1 0 5 = 52413d4f 4b
f688cc40 3278273153 S Bi:5:009:1 -115 64 <
f688cbc0 3278361035 S Bo:5:009:1 -115 2 = 4307
f688cbc0 3278362103 C Bo:5:009:1 0 2 >
f688cc40 3278363132 C Bi:5:009:1 0 3 = 435020
f688cc40 3278363139 S Bi:5:009:1 -115 64 <
f688cc40 3281177152 C Bi:5:009:1 0 5 = 43503d4f 4b
f688cc40 3281177160 S Bi:5:009:1 -115 64 <

Done.


Direct copy:
First we do a scan:
f688cbc0 3706875313 S Bo:5:009:1 -115 2 = 5207
f688cbc0 3706877191 C Bo:5:009:1 0 2 >
f688cc40 3706879183 C Bi:5:009:1 0 5 = 52656164 79
f688cc40 3706879187 S Bi:5:009:1 -115 64 <
f688cc40 3709769200 C Bi:5:009:1 0 64 = 52442002 e3020314 87010411 80010108 8701060b 800101f7 070106f1 000101e2
f688cc40 3709769209 S Bi:5:009:1 -115 64 <
f688cc40 3709785195 C Bi:5:009:1 0 64 = 0701069d 00010396 07010692 0001018e 07010691 0001018e 07010549 00460401
f688cc40 3709785198 S Bi:5:009:1 -115 64 <
f688cc40 3709801195 C Bi:5:009:1 0 64 = 06490043 04010546 03460201 00450542 07010684 0001013f 073d0301 003e043e
f688cc40 3709801198 S Bi:5:009:1 -115 64 <
f688cc40 3709817194 C Bi:5:009:1 0 64 = 05010133 03010236 04370501 00350238 00010236 07350301 00360436 05010035
f688cc40 3709817197 S Bi:5:009:1 -115 64 <
f688cc40 3709834198 C Bi:5:009:1 0 64 = 05340301 02350435 05010035 02340001 01680701 06350035 04010532 03010232
f688cc40 3709834201 S Bi:5:009:1 -115 64 <
f688cc40 3709850197 C Bi:5:009:1 0 64 = 03010232 06350101 00330601 00320101 05330636 01010032 02010733 05330301
f688cc40 3709850200 S Bi:5:009:1 -115 64 <
f688cc40 3709866186 C Bi:5:009:1 0 64 = 04010733 03330601 00330135 06350101 00300601 04340101 00310201 00330532
f688cc40 3709866193 S Bi:5:009:1 -115 64 <
f688cc40 3709883184 C Bi:5:009:1 0 64 = 02300101 072d0601 022e0101 022c0601 052d0101 002b0201 072d0501 012a0330
f688cc40 3709883190 S Bi:5:009:1 -115 64 <
f688cc40 3709899158 C Bi:5:009:1 0 64 = 022b0401 05280101 0029062a 05010029 02290001 0553072d 00280401 05280301
f688cc40 3709899166 S Bi:5:009:1 -115 64 <
f688cc40 3709915186 C Bi:5:009:1 0 64 = 00280401 05270328 02010028 05250701 06280028 04010526 03010224 06280101
f688cc40 3709915191 S Bi:5:009:1 -115 64 <
f688cc40 3709932187 C Bi:5:009:1 0 64 = 03010220 06010721 01010021 02010323 05210701 06230023 04010720 03240201
f688cc40 3709932193 S Bi:5:009:1 -115 64 <
f688cc40 3709947370 C Bi:5:009:1 0 64 = 06450001 03430701 06200023 0401011d 0301021e 0601051e 0101001d 0201011f
f688cc40 3709947375 S Bi:5:009:1 -115 64 <
f688cc40 3709964189 C Bi:5:009:1 0 64 = 0601041d 011f0201 011c0501 07190301 021b0401 051b0101 001b0601 071b0501
f688cc40 3709964197 S Bi:5:009:1 -115 64 <
f688cc40 3709981156 C Bi:5:009:1 0 64 = 05390001 013a0701 041a001c 0401071a 031c0201 031a051a 0701061a 001b0401
f688cc40 3709981162 S Bi:5:009:1 -115 64 <
f688cc40 3709997159 C Bi:5:009:1 0 64 = 00010319 07170301 0218041b 05010617 0219001c 07190301 00170401 05160101
f688cc40 3709997169 S Bi:5:009:1 -115 64 <
f688cc40 3710013189 C Bi:5:009:1 0 64 = 07010617 00190418 03010214 06010715 01010014 06010714 01010214 06010514
f688cc40 3710013195 S Bi:5:009:1 -115 64 <
f688cc40 3710030187 C Bi:5:009:1 0 64 = 04010515 03010213 06010515 01010015 02010315 05010714 03010216 04190501
f688cc40 3710030193 S Bi:5:009:1 -115 64 <
f688cc40 3710046157 C Bi:5:009:1 0 64 = 00300701 062f0031 07010416 00180401 07150319 06180101 02140601 052f011a
f688cc40 3710046163 S Bi:5:009:1 -115 64 <
f688cc40 3710063194 C Bi:5:009:1 0 64 = 00170601 00160101 0517061b 011a0601 04160101 00170601 07170101 00160201
f688cc40 3710063198 S Bi:5:009:1 -115 64 <
f688cc40 3710079198 C Bi:5:009:1 0 64 = 03190701 06330001 05320701 04320001 03300701 06320001 05310701 04310001
f688cc40 3710079201 S Bi:5:009:1 -115 64 <
f688cc40 3710095195 C Bi:5:009:1 0 64 = 05300001 022f0701 02300032 0701052f 0001022e 0701062f 0001012f 0701042e
f688cc40 3710095200 S Bi:5:009:1 -115 64 <
f688cc40 3710112194 C Bi:5:009:1 0 64 = 022c0001 042e0730 002f07ff 8053000d 020903ff 87ff87ff 87ff87ff 87ff87ff
f688cc40 3710112197 S Bi:5:009:1 -115 64 <
f688cc40 3710128199 C Bi:5:009:1 0 64 = 87ff87ff 87ff87ff 87ff87ff 87ff87ff 87ff87ff 87ff87ff 87ff87ff 87ff87ff
f688cc40 3710128202 S Bi:5:009:1 -115 64 <
f688cc40 3710132197 C Bi:5:009:1 0 18 = 87ff87ff 87ff87ff 87260501 0452443d 4f4b
f688cc40 3710132200 S Bi:5:009:1 -115 64 <
f688cbc0 3710557723 S Bo:5:009:1 -115 2 = 5207
f688cbc0 3710559191 C Bo:5:009:1 0 2 >
f688cc40 3710561156 C Bi:5:009:1 0 5 = 52656164 79
f688cc40 3710561161 S Bi:5:009:1 -115 64 <

Card slid. Now we hit direct copy:
f688cbc0 3722917341 S Bo:5:009:1 -115 2 = 4307
f688cbc0 3722919193 C Bo:5:009:1 0 2 >
f688cc40 3722920157 C Bi:5:009:1 0 3 = 435020
f688cc40 3722920163 S Bi:5:009:1 -115 64 <
f688cc40 3725186209 C Bi:5:009:1 0 5 = 43503d4f 4b
f688cc40 3725186217 S Bi:5:009:1 -115 64 <

Card copied.

