Byte decoding and protocol commentary with your host ioerror follows the '#'
This is T=0 and we'll now start the MAKStripe software:

A basic explaination for the conventions of the USB dump:
'Co' = Control output
'Ci' = Control input
'Bo' = Bulk output
'Bi' = Bulk input

A full explaination is here:
http://lxr.linux.no/linux+v2.6.28.8/Documentation/usb/usbmon.txt

Arm yourself with the contents of `man ascii` and begin!

f688cdc0 3722032316 S Co:5:009:0 s 41 00 0001 0000 0000 0
f688cdc0 3722033633 C Co:5:009:0 0 0
f688cdc0 3722033649 S Co:5:009:0 s 41 00 0001 0000 0000 0
f688cdc0 3722034625 C Co:5:009:0 0 0
f688cc40 3722034649 S Bi:5:009:1 -115 64 <
f688cdc0 3722034652 S Ci:5:009:0 s c1 02 0000 0000 0002 2 <
f688cdc0 3722035620 C Ci:5:009:0 0 2 = 6000
f688cdc0 3722035646 S Ci:5:009:0 s c1 04 0000 0000 0002 2 <
f688cdc0 3722036623 C Ci:5:009:0 0 2 = 0208
f688cdc0 3722036651 S Ci:5:009:0 s c1 14 0000 0000 0010 16 <
f688cdc0 3722037631 C Ci:5:009:0 0 16 = 00000000 00000000 00000000 00000000
f688cdc0 3722037650 S Co:5:009:0 s 41 07 0303 0000 0000 0
f688cdc0 3722038622 C Co:5:009:0 0 0
f688cdc0 3722038640 S Co:5:009:0 s 41 07 0303 0000 0000 0
f688cdc0 3722039609 C Co:5:009:0 0 0
f688cbc0 3722039657 S Bo:5:009:1 -115 1 = 3f
f688cbc0 3722040630 C Bo:5:009:1 0 1 >
f688cc40 3722044630 C Bi:5:009:1 0 15 = 4d535553 42204349 2e323730 323039
f688cc40 3722044634 S Bi:5:009:1 -115 64 <

Startup completed.

Lets scan for cards now:

f688cbc0 3746063312 S Bo:5:009:1 -115 2 = 5207
f688cbc0 3746064593 C Bo:5:009:1 0 2 >
f688cc40 3746066618 C Bi:5:009:1 0 5 = 52656164 79
f688cc40 3746066624 S Bi:5:009:1 -115 64 <

The device is now waiting for a stripe to pass through the MAKStripe.

I will now scan a safeway club card (ISO formatted data is expected):

f688cc40 3808476644 C Bi:5:009:1 0 64 = 52442001 7026029a 03bc01bb 03b201b0 039c019c 039d01a2 03990199 03940197
f688cc40 3808476655 S Bi:5:009:1 -115 64 <
f688cc40 3808491634 C Bi:5:009:1 0 64 = 038c0147 03430146 03420191 03440147 03860185 03850187 033f0142 037f0180
f688cc40 3808491638 S Bi:5:009:1 -115 64 <
f688cc40 3808508633 C Bi:5:009:1 0 64 = 0332016f 03350138 036c0137 0334016c 03320135 0367016c 03330135 0368016c
f688cc40 3808508637 S Bi:5:009:1 -115 64 <
f688cc40 3808524634 C Bi:5:009:1 0 64 = 035e0162 032d0130 03600162 032e0130 032c0130 032c012f 035e0130 032c0161
f688cc40 3808524638 S Bi:5:009:1 -115 64 <
f688cc40 3808540603 C Bi:5:009:1 0 64 = 032f0132 03600162 035f0161 035f0162 035e0131 032d0161 03600162 035f0161
f688cc40 3808540611 S Bi:5:009:1 -115 64 <
f688cc40 3808557630 C Bi:5:009:1 0 64 = 0327012b 0329012b 03540157 0327012a 03260129 03510152 034f0154 03250126
f688cc40 3808557636 S Bi:5:009:1 -115 64 <
f688cc40 3808573599 C Bi:5:009:1 0 64 = 0348014b 03220126 03210125 03220124 0348014b 0346014a 03470149 0346014b
f688cc40 3808573606 S Bi:5:009:1 -115 64 <
f688cc40 3808590602 C Bi:5:009:1 0 64 = 03420146 03430146 03430146 03430147 03430148 03430148 03460149 03460148
f688cc40 3808590609 S Bi:5:009:1 -115 64 <
f688cc40 3808606632 C Bi:5:009:1 0 64 = 0347014c 0347014d 0348014a 0347014c 0348014b 0348014b 0346014c 0348014b
f688cc40 3808606642 S Bi:5:009:1 -115 64 <
f688cc40 3808622601 C Bi:5:009:1 0 64 = 0348014b 0348014a 03450149 0346014b 0345014a 03440149 0345014a 03440148
f688cc40 3808622609 S Bi:5:009:1 -115 64 <
f688cc40 3808639603 C Bi:5:009:1 0 64 = 80ff80ff 80ff80ff 80ff80ff 80ff80ff 80ff80ff 80ff80ff 80ff80ff 80ff80ff
f688cc40 3808639613 S Bi:5:009:1 -115 64 <
f688cc40 3808649642 C Bi:5:009:1 0 42 = 80ff80ff 80ff80ff 80ff80ff 80ff80ff 80ff80ff 80ff80ff 80ff80ff 80ff80ff
f688cc40 3808649648 S Bi:5:009:1 -115 64 <
f688cbc0 3809052395 S Bo:5:009:1 -115 2 = 5207
f688cbc0 3809053602 C Bo:5:009:1 0 2 >
f688cc40 3809055598 C Bi:5:009:1 0 5 = 52656164 79
f688cc40 3809055604 S Bi:5:009:1 -115 64 <

That is the end of the swip for the safeway club card.

The card only contains track 2 information as follows:
;60058541029558180=9904?<

This is a copy of the card by pressing the COPY button in bright red:
f688cbc0 3951924433 S Bo:5:009:1 -115 3 = 58012e
f688cbc0 3951925653 C Bo:5:009:1 0 3 >
f688cc40 3951927648 C Bi:5:009:1 0 3 = 574220
f688cc40 3951927654 S Bi:5:009:1 -115 64 <
f688cbc0 3952069109 S Bo:5:009:1 -115 64 = f000ef02 ef00ef02 ee00ee02 ed00ed02 ed00ec02 ec00eb02 eb00ea02 ea00ea02
f688cbc0 3952069656 C Bo:5:009:1 0 64 >
f688cbc0 3952069715 S Bo:5:009:1 -115 64 = 72007202 72007202 e3007102 7100e202 e200e202 e1007002 7000e002 e000e002
f688cbc0 3952070651 C Bo:5:009:1 0 64 >
f688cbc0 3952070702 S Bo:5:009:1 -115 64 = db006d02 6d00da02 6d006d02 d9006c02 6c00d802 d8006c02 6c00d702 d7006b02
f688cbc0 3952071651 C Bo:5:009:1 0 64 >
f688cbc0 3952071702 S Bo:5:009:1 -115 64 = d0006802 6800d002 cf006702 67006702 67006702 6700ce02 67006702 cd006602
f688cbc0 3952072651 C Bo:5:009:1 0 64 >
f688cbc0 3952072703 S Bo:5:009:1 -115 64 = 6400c802 c700c702 c600c602 c600c502 62006202 c400c402 c300c302 c3006102
f688cbc0 3952073657 C Bo:5:009:1 0 64 >
f688cbc0 3952073676 S Bo:5:009:1 -115 64 = 5f005f02 5f00bd02 bd005e02 5e005e02 5e00bc02 bb00bb02 bb005d02 5d00ba02
f688cbc0 3952074656 C Bo:5:009:1 0 64 >
f688cbc0 3952074706 S Bo:5:009:1 -115 64 = b5005a02 5a005a02 5a005a02 5a00b402 b300b302 b200b202 b200b102 b100b002
f688cbc0 3952075661 C Bo:5:009:1 0 64 >
f688cbc0 3952075678 S Bo:5:009:1 -115 64 = a900a902 a900a802 a800a702 a700a702 a600a602 a500a502 a500a402 a400a302
f688cbc0 3952076654 C Bo:5:009:1 0 64 >
f688cbc0 3952076671 S Bo:5:009:1 -115 64 = 9c009c02 9c009b02 9b009a02 9a009a02 99009902 98009802 98009702 97009602
f688cbc0 3952077649 C Bo:5:009:1 0 64 >
f688cbc0 3952077666 S Bo:5:009:1 -115 28 = 8f008f02 8f008e02 8e008d02 8d008d02 8c008c02 8b008b02 8b008a02
f688cbc0 3952088662 C Bo:5:009:1 0 28 >
f688cc40 3952244655 C Bi:5:009:1 0 5 = 57423d4f 4b
f688cc40 3952244663 S Bi:5:009:1 -115 64 <
f688cbc0 3952470238 S Bo:5:009:1 -115 2 = 5707
f688cbc0 3952470625 C Bo:5:009:1 0 2 >
f688cc40 3952472646 C Bi:5:009:1 0 3 = 524120
f688cc40 3952472651 S Bi:5:009:1 -115 64 <
f688cc40 3959514663 C Bi:5:009:1 0 5 = 52413d4f 4b
f688cc40 3959514673 S Bi:5:009:1 -115 64 <
f688cbc0 3959652667 S Bo:5:009:1 -115 2 = 4307
f688cbc0 3959653652 C Bo:5:009:1 0 2 >
f688cc40 3959655618 C Bi:5:009:1 0 3 = 435020
f688cc40 3959655624 S Bi:5:009:1 -115 64 <
f688cc40 3961729652 C Bi:5:009:1 0 5 = 43503d4f 4b
f688cc40 3961729661 S Bi:5:009:1 -115 64 <

The MAKStripe software asked for a reference card, i swiped it; it asked me to swipe the card again, i did.
This then wrote out the reference card to the second swipe. I used a hotel card key. Annoying.

I will now try the direct copy button:
f688cbc0 4223683583 S Bo:5:009:1 -115 2 = 4307
f688cbc0 4223684655 C Bo:5:009:1 0 2 >
f688cc40 4223685652 C Bi:5:009:1 0 3 = 435020
f688cc40 4223685656 S Bi:5:009:1 -115 64 <
f688cc40 4227942693 C Bi:5:009:1 0 5 = 43503d4f 4b
f688cc40 4227942703 S Bi:5:009:1 -115 64 <

I will now read the safeway card again:
f688cbc0 4289586698 S Bo:5:009:1 -115 2 = 5207
f688cbc0 4289588687 C Bo:5:009:1 0 2 >
f688cc40 4289590659 C Bi:5:009:1 0 5 = 52656164 79
f688cc40 4289590665 S Bi:5:009:1 -115 64 <
f688cc40 4293834706 C Bi:5:009:1 0 64 = 52442001 6e208221 8026821a 800f82f3 00ec02e9 00ed02db 00d702cf 00d102cb
f688cc40 4293834714 S Bi:5:009:1 -115 64 <
f688cc40 4293849695 C Bi:5:009:1 0 64 = 0054024f 0053024f 00a90251 0052029d 009b029c 009f024c 004f029a 009d0298
f688cc40 4293849699 S Bi:5:009:1 -115 64 <
f688cc40 4293866694 C Bi:5:009:1 0 64 = 00900244 0047028d 00450245 008c0243 00450288 008e0244 0047028a 008e0245
f688cc40 4293866697 S Bi:5:009:1 -115 64 <
f688cc40 4293882695 C Bi:5:009:1 0 64 = 00920245 0047028f 00900246 00480243 00470244 0046028e 00480244 00920245
f688cc40 4293882697 S Bi:5:009:1 -115 64 <
f688cc40 4293898683 C Bi:5:009:1 0 64 = 00490290 0091028d 0090028c 008d028b 00450242 008a0287 008a0287 00880240
f688cc40 4293898687 S Bi:5:009:1 -115 64 <
f688cc40 4293915699 C Bi:5:009:1 0 64 = 003f023c 003e027c 007c0239 003d0239 003c0274 00740272 00740235 0037026b
f688cc40 4293915702 S Bi:5:009:1 -115 64 <
f688cc40 4293931699 C Bi:5:009:1 0 64 = 006a0233 00370232 00350232 0036026a 006d0269 006b0269 006c026a 006d0268
f688cc40 4293931703 S Bi:5:009:1 -115 64 <
f688cc40 4293947693 C Bi:5:009:1 0 64 = 00650264 00660263 00650264 00680264 00660263 00660264 00670264 00660262
f688cc40 4293947696 S Bi:5:009:1 -115 64 <
f688cc40 4293964694 C Bi:5:009:1 0 64 = 006a0266 006c0267 006b0267 006d026a 006d026b 006c026b 006d026d 006e026e
f688cc40 4293964697 S Bi:5:009:1 -115 64 <
f688cc40 4293980698 C Bi:5:009:1 0 64 = 00770273 00750270 00730273 00760272 0071026e 00710271 0072026f 006f026e
f688cc40 4293980702 S Bi:5:009:1 -115 64 <
f688cc40 4293997693 C Bi:5:009:1 0 64 = 80ff80ff 80ff80ff 80ff80ff 80ff80ff 80ff80ff 80ff80ff 80ff80ff 80ff80ff
f688cc40 4293997701 S Bi:5:009:1 -115 64 <
f688cc40 4294006691 C Bi:5:009:1 0 38 = 80ff80ff 80ff80ff 80ff80ff 80ff80ff 80ff80ff 80ff80ff 80ff80ff 80ff80ff
f688cc40 4294006698 S Bi:5:009:1 -115 64 <
f688cbc0 4294487739 S Bo:5:009:1 -115 2 = 5207
f688cbc0 4294489695 C Bo:5:009:1 0 2 >
f688cc40 4294491675 C Bi:5:009:1 0 5 = 52656164 79
f688cc40 4294491681 S Bi:5:009:1 -115 64 <

Safeway card read into the program (and probably the MAKStripe's internal buffer).

I will now use the direct copy button again:
f688cbc0 31079361 S Bo:5:009:1 -115 2 = 4307
f688cbc0 31081405 C Bo:5:009:1 0 2 >
f688cc40 31082397 C Bi:5:009:1 0 3 = 435020
f688cc40 31082401 S Bi:5:009:1 -115 64 <
f688cc40 34799413 C Bi:5:009:1 0 5 = 43503d4f 4b
f688cc40 34799423 S Bi:5:009:1 -115 64 <

The card was written out to the hotel key.

I will now read the hotel key:
This is the result of the scan port for data button again... 

f688cbc0 65961021 S Bo:5:009:1 -115 2 = 5207
f688cbc0 65962409 C Bo:5:009:1 0 2 >
f688cc40 65964373 C Bi:5:009:1 0 5 = 52656164 79
f688cc40 65964379 S Bi:5:009:1 -115 64 <
f688cc40 70065394 C Bi:5:009:1 0 64 = 52442001 71ce02cb 00d002ce 00c202b2 00a902a7 00a7029b 00990298 009d029f
f688cc40 70065402 S Bi:5:009:1 -115 64 <
f688cc40 70081402 C Bi:5:009:1 0 64 = 004b0248 004a024a 0097024d 00480291 00890291 0090024a 0048028e 008d0290
f688cc40 70081406 S Bi:5:009:1 -115 64 <
f688cc40 70097410 C Bi:5:009:1 0 64 = 00810242 00410283 003e0242 007f0240 003d0281 00820244 003f0284 00800246
f688cc40 70097413 S Bi:5:009:1 -115 64 <
f688cc40 70113409 C Bi:5:009:1 0 64 = 008b0245 0042028d 00880247 00460244 00450245 0043028d 00430243 008b0246
f688cc40 70113413 S Bi:5:009:1 -115 64 <
f688cc40 70130410 C Bi:5:009:1 0 64 = 00430285 00870284 00840287 00800285 0040023f 007c0281 007e027f 007e023e
f688cc40 70130414 S Bi:5:009:1 -115 64 <
f688cc40 70146415 C Bi:5:009:1 0 64 = 003c0238 003a0273 00730235 00390235 0038026b 006c026a 006e0232 00330264
f688cc40 70146418 S Bi:5:009:1 -115 64 <
f688cc40 70162373 C Bi:5:009:1 0 64 = 0060022e 0033022d 0030022d 0032025e 0063025e 0062025f 0064025f 0064025f
f688cc40 70162377 S Bi:5:009:1 -115 64 <
f688cc40 70179410 C Bi:5:009:1 0 64 = 005e025b 005e025a 005e025c 0061025b 005e0259 005d0259 005d0259 005b0258
f688cc40 70179413 S Bi:5:009:1 -115 64 <
f688cc40 70195406 C Bi:5:009:1 0 64 = 0063025c 0063025c 0061025c 0062025f 0062025f 00620260 00630262 00630264
f688cc40 70195409 S Bi:5:009:1 -115 64 <
f688cc40 70211406 C Bi:5:009:1 0 64 = 006b0265 00690264 00670268 006a0267 00650263 00650265 00660262 00650260
f688cc40 70211414 S Bi:5:009:1 -115 64 <
f688cc40 70228376 C Bi:5:009:1 0 64 = 87ff87ff 87ff87ff 87ff87ff 87ff87ff 87ff87ff 87ff87ff 87ff87ff 87ff87ff
f688cc40 70228386 S Bi:5:009:1 -115 64 <
f688cc40 70239377 C Bi:5:009:1 0 46 = 87ff87ff 87ff87ff 87ff87ff 87ff87ff 87ff87ff 87ff87ff 87ff87ff 87ff87ff
f688cc40 70239384 S Bi:5:009:1 -115 64 <
f688cbc0 70702866 S Bo:5:009:1 -115 2 = 5207
f688cbc0 70704409 C Bo:5:009:1 0 2 >
f688cc40 70706396 C Bi:5:009:1 0 5 = 52656164 79
f688cc40 70706403 S Bi:5:009:1 -115 64 <

This resulted in a copy of the safeway card in the programs buffer. I will try another direct copy:
f688cbc0 101770576 S Bo:5:009:1 -115 2 = 4307
f688cbc0 101772413 C Bo:5:009:1 0 2 >
f688cc40 101773380 C Bi:5:009:1 0 3 = 435020
f688cc40 101773385 S Bi:5:009:1 -115 64 <
f688cc40 105367412 C Bi:5:009:1 0 5 = 43503d4f 4b
f688cc40 105367422 S Bi:5:009:1 -115 64 <

The card data is now again written to the hotel key.

Just for giggles, I will now format all three tracks of the hotel card key:
f688cbc0 143055701 S Bo:5:009:1 -115 4 = 46072064
f688cbc0 143057419 C Bo:5:009:1 0 4 >
f688cc40 143059382 C Bi:5:009:1 0 3 = 464d20
f688cc40 143059387 S Bi:5:009:1 -115 64 <
f688cc40 148056428 C Bi:5:009:1 0 5 = 464d3d4f 4b
f688cc40 148056438 S Bi:5:009:1 -115 64 <

I will now try a direct copy again (to see if the buffer on the card is still there):
f688cbc0 255130623 S Bo:5:009:1 -115 2 = 4307
f688cbc0 255132433 C Bo:5:009:1 0 2 >
f688cc40 255133397 C Bi:5:009:1 0 3 = 435020
f688cc40 255133402 S Bi:5:009:1 -115 64 <
f688cc40 258076453 C Bi:5:009:1 0 5 = 43503d4f 4b
f688cc40 258076472 S Bi:5:009:1 -115 64 <

I will now scan the card (the hotel card that just got a direct copy):
f688cbc0 273156227 S Bo:5:009:1 -115 2 = 5207
f688cbc0 273157430 C Bo:5:009:1 0 2 >
f688cc40 273159423 C Bi:5:009:1 0 5 = 52656164 79
f688cc40 273159428 S Bi:5:009:1 -115 64 <
f688cc40 275758445 C Bi:5:009:1 0 64 = 52442001 30d802c6 00ac02a6 008a0281 00730278 0070026f 00630269 005f026a
f688cc40 275758454 S Bi:5:009:1 -115 64 <
f688cc40 275773436 C Bi:5:009:1 0 64 = 00370236 00310238 006e023d 0032026e 00670272 006f0240 00380276 0071027a
f688cc40 275773440 S Bi:5:009:1 -115 64 <
f688cc40 275790434 C Bi:5:009:1 0 64 = 008c0251 004a029d 00450252 00990256 004c02a9 00a6025b 005302b2 00ab0266
f688cc40 275790439 S Bi:5:009:1 -115 64 <
f688cc40 275806433 C Bi:5:009:1 0 64 = 00e80282 006d02ee 00de027d 006f0276 0077027b 006e02ee 00690271 00e2027c
f688cc40 275806437 S Bi:5:009:1 -115 64 <
f688cc40 275822301 C Bi:5:009:1 0 64 = 006102c2 00bb02bb 00b102b9 00a902b8 004f0259 00a402ad 00a902b1 00ac025b
f688cc40 275822304 S Bi:5:009:1 -115 64 <
f688cc40 275839439 C Bi:5:009:1 0 64 = 005a0261 005702af 00b10258 005f025c 005302ae 00ab02ae 00af0263 004e02ac
f688cc40 275839444 S Bi:5:009:1 -115 64 <
f688cc40 275855436 C Bi:5:009:1 0 64 = 00b00264 00610257 005d0265 005c02be 00c502c5 00cb02d1 00cd02cf 00ce02cc
f688cc40 275855440 S Bi:5:009:1 -115 64 <
f688cc40 275871408 C Bi:5:009:1 0 64 = 00d002ce 00ce02c2 00c102c5 00c302bf 00b602b5 00b802b4 00b602b2 00af02b8
f688cc40 275871412 S Bi:5:009:1 -115 64 <
f688cc40 275888429 C Bi:5:009:1 0 64 = 85ff85ff 85ff85ff 85ff85ff 85ff85ff 85ff85ff 85ff85ff 85ff85ff 85ff85ff
f688cc40 275888433 S Bi:5:009:1 -115 64 <
f688cc40 275898435 C Bi:5:009:1 0 42 = 85ff85ff 85ff85ff 85ff85ff 85ff85ff 85ff85ff 85ff85ff 85ff85ff 85ff85ff
f688cc40 275898438 S Bi:5:009:1 -115 64 <
f688cbc0 276427433 S Bo:5:009:1 -115 2 = 5207
f688cbc0 276429435 C Bo:5:009:1 0 2 >
f688cc40 276431398 C Bi:5:009:1 0 5 = 52656164 79
f688cc40 276431406 S Bi:5:009:1 -115 64 <

As we can see, the buffer isn't affected by the fact that we have erased the card.    
We have the tecnology, we can rebuffer it.

But as you see, we don't need to. It buffered and stayed put. Great!

Now we will stop scanning (is this like a reset command?):

f688cbc0 429256014 S Bo:5:009:1 -115 1 = 3f
f688cbc0 429257461 C Bo:5:009:1 0 1 >
f688cc40 429261462 C Bi:5:009:1 0 15 = 4d535553 42204349 2e323730 323039
f688cc40 429261467 S Bi:5:009:1 -115 64 <

(perhaps?)

(it may also just be telling the reader to reset and thus it will reset, printing firmware info)
(This may stop us from doing a direct copy, reading the firmware info and then attempting to write from the buffer on the device. Perhaps?)


Now to run through all of the commands one by one.

This is the scan command:
f688cbc0 932596235 S Bo:5:009:1 -115 2 = 5207
f688cbc0 932597486 C Bo:5:009:1 0 2 >
f688cc40 932599481 C Bi:5:009:1 0 5 = 52656164 79
f688cc40 932599488 S Bi:5:009:1 -115 64 <
f688cc40 936295529 C Bi:5:009:1 0 64 = 52442001 7216028e 03a601ae 03a901a9 0398019a 039b01a3 03970198 03900194
f688cc40 936295538 S Bi:5:009:1 -115 64 <
f688cc40 936310521 C Bi:5:009:1 0 64 = 0377013e 0338013d 0338017d 033a013c 03720172 03700173 03360138 036d016f
f688cc40 936310525 S Bi:5:009:1 -115 64 <
f688cc40 936326520 C Bi:5:009:1 0 64 = 032d0165 032f0133 03610132 032f0163 032d0131 035d0162 032e0130 035c015f
f688cc40 936326523 S Bi:5:009:1 -115 64 <
f688cc40 936343520 C Bi:5:009:1 0 64 = 03540157 0328012a 03530155 0329012a 0325012a 03260129 0351012a 03250152
f688cc40 936343524 S Bi:5:009:1 -115 64 <
f688cc40 936359513 C Bi:5:009:1 0 64 = 03250128 034a014e 034a014d 0349014c 03490126 0320014b 0347014c 0348014c
f688cc40 936359524 S Bi:5:009:1 -115 64 <
f688cc40 936375519 C Bi:5:009:1 0 64 = 03210127 03220125 034a014b 03210126 03210125 03460148 0347014a 03210123
f688cc40 936375524 S Bi:5:009:1 -115 64 <
f688cc40 936392515 C Bi:5:009:1 0 64 = 03400141 031f0121 031c0121 031c0120 033d0143 033e0141 033d0142 033e0141
f688cc40 936392519 S Bi:5:009:1 -115 64 <
f688cc40 936408519 C Bi:5:009:1 0 64 = 0339013b 0339013c 0338013a 0338013b 0338013a 0337013a 0337013b 03370139
f688cc40 936408522 S Bi:5:009:1 -115 64 <
f688cc40 936425517 C Bi:5:009:1 0 64 = 03350138 03360139 03360137 03350139 03350138 03350137 03350137 03350137
f688cc40 936425525 S Bi:5:009:1 -115 64 <
f688cc40 936441485 C Bi:5:009:1 0 64 = 03320137 03330135 03310135 03330136 03330135 03310135 03310135 03320134
f688cc40 936441494 S Bi:5:009:1 -115 64 <
f688cc40 936457486 C Bi:5:009:1 0 64 = 80ff80ff 80ff80ff 80ff80ff 80ff80ff 80ff80ff 80ff80ff 80ff80ff 80ff80ff
f688cc40 936457493 S Bi:5:009:1 -115 64 <
f688cc40 936469515 C Bi:5:009:1 0 46 = 80ff80ff 80ff80ff 80ff80ff 80ff80ff 80ff80ff 80ff80ff 80ff80ff 80ff80ff
f688cc40 936469521 S Bi:5:009:1 -115 64 <
f688cbc0 936833716 S Bo:5:009:1 -115 2 = 5207
f688cbc0 936835484 C Bo:5:009:1 0 2 >
f688cc40 936837484 C Bi:5:009:1 0 5 = 52656164 79
f688cc40 936837491 S Bi:5:009:1 -115 64 <

Safeway card scanned again.

f688cbc0 947000260 S Bo:5:009:1 -115 3 = 450704
f688cbc0 947001487 C Bo:5:009:1 0 3 >
f688cc40 947003515 C Bi:5:009:1 0 3 = 457220
f688cc40 947003522 S Bi:5:009:1 -115 64 <

f688cc40 950938526 C Bi:5:009:1 0 5 = 45723d4f 4b
f688cc40 950938534 S Bi:5:009:1 -115 64 <

That above was the erase command (From the process menu). Swiping hotel card:

(nothing happened at swipe time because the reader knew what to do and had already ack'ed the cmd)

Now we will use the format command (also from the process menu). Swiping hotel card:
f688cbc0 1019189920 S Bo:5:009:1 -115 4 = 46072064
f688cbc0 1019191530 C Bo:5:009:1 0 4 >
f688cc40 1019193528 C Bi:5:009:1 0 3 = 464d20
f688cc40 1019193533 S Bi:5:009:1 -115 64 <
f688cc40 1024191499 C Bi:5:009:1 0 5 = 464d3d4f 4b
f688cc40 1024191508 S Bi:5:009:1 -115 64 <

We will now use the write command (also from the process menu).
Swiping hotel card here:
f688cbc0 1147823654 S Bo:5:009:1 -115 3 = 58012e
f688cbc0 1147825557 C Bo:5:009:1 0 3 >
f688cc40 1147827511 C Bi:5:009:1 0 3 = 574220
f688cc40 1147827517 S Bi:5:009:1 -115 64 <
f688cbc0 1148048406 S Bo:5:009:1 -115 64 = f000ef02 ef00ef02 ee00ee02 ed00ed02 ed00ec02 ec00eb02 eb00ea02 ea00ea02
f688cbc0 1148048546 C Bo:5:009:1 0 64 >
f688cbc0 1148048623 S Bo:5:009:1 -115 64 = 72007202 72007202 e3007102 7100e202 e200e202 e1007002 7000e002 e000e002
f688cbc0 1148049556 C Bo:5:009:1 0 64 >
f688cbc0 1148049580 S Bo:5:009:1 -115 64 = db006d02 6d00da02 6d006d02 d9006c02 6c00d802 d8006c02 6c00d702 d7006b02
f688cbc0 1148050513 C Bo:5:009:1 0 64 >
f688cbc0 1148050569 S Bo:5:009:1 -115 64 = d0006802 6800d002 cf006702 67006702 67006702 6700ce02 67006702 cd006602
f688cbc0 1148051554 C Bo:5:009:1 0 64 >
f688cbc0 1148051572 S Bo:5:009:1 -115 64 = 6400c802 c700c702 c600c602 c600c502 62006202 c400c402 c300c302 c3006102
f688cbc0 1148052537 C Bo:5:009:1 0 64 >
f688cbc0 1148052555 S Bo:5:009:1 -115 64 = 5f005f02 5f00bd02 bd005e02 5e005e02 5e00bc02 bb00bb02 bb005d02 5d00ba02
f688cbc0 1148053544 C Bo:5:009:1 0 64 >
f688cbc0 1148053626 S Bo:5:009:1 -115 64 = b5005a02 5a005a02 5a005a02 5a00b402 b300b302 b200b202 b200b102 b100b002
f688cbc0 1148054543 C Bo:5:009:1 0 64 >
f688cbc0 1148054592 S Bo:5:009:1 -115 64 = a900a902 a900a802 a800a702 a700a702 a600a602 a500a502 a500a402 a400a302
f688cbc0 1148055554 C Bo:5:009:1 0 64 >
f688cbc0 1148055571 S Bo:5:009:1 -115 64 = 9c009c02 9c009b02 9b009a02 9a009a02 99009902 98009802 98009702 97009602
f688cbc0 1148056550 C Bo:5:009:1 0 64 >
f688cbc0 1148056567 S Bo:5:009:1 -115 28 = 8f008f02 8f008e02 8e008d02 8d008d02 8c008c02 8b008b02 8b008a02
f688cbc0 1148068549 C Bo:5:009:1 0 28 >
f688cc40 1148224545 C Bi:5:009:1 0 5 = 57423d4f 4b
f688cc40 1148224553 S Bi:5:009:1 -115 64 <
f688cbc0 1148450156 S Bo:5:009:1 -115 2 = 5707
f688cbc0 1148450546 C Bo:5:009:1 0 2 >
f688cc40 1148452511 C Bi:5:009:1 0 3 = 524120
f688cc40 1148452525 S Bi:5:009:1 -115 64 <

The data was buffered from the first read (safeway card) and was sent to the reader.
Now the reader is ready to write to the card. Swiping hotel card again:
f688cc40 1183705553 C Bi:5:009:1 0 5 = 52413d4f 4b
f688cc40 1183705564 S Bi:5:009:1 -115 64 <
f688cbc0 1183959250 S Bo:5:009:1 -115 2 = 4307
f688cbc0 1183959551 C Bo:5:009:1 0 2 >
f688cc40 1183961522 C Bi:5:009:1 0 3 = 435020
f688cc40 1183961529 S Bi:5:009:1 -115 64 <

Oddly, the software says: "ready to write, please swipe a card. Swiping now:
f688cc40 1219615562 C Bi:5:009:1 0 5 = 43503d4f 4b
f688cc40 1219615573 S Bi:5:009:1 -115 64 <

It reports that the card was written. Clearly by using the buffer.  

Now I will push the cancel processing button:
f688cbc0 1258314532 S Bo:5:009:1 -115 1 = 3f
f688cbc0 1258316567 C Bo:5:009:1 0 1 >
f688cc40 1258320560 C Bi:5:009:1 0 15 = 4d535553 42204349 2e323730 323039
f688cc40 1258320565 S Bi:5:009:1 -115 64 <

This appears to be the value '?' again. Cancel processing and reset and getting the firmware are the same!

Now I will write out track 2 data of the safeway card to the hotel card.
First I will select the autoformat option that should first erase the card and then secondly copy the track 2 data onto the card.

f688cbc0 1546603764 S Bo:5:009:1 -115 3 = 58012e
f688cbc0 1546605565 C Bo:5:009:1 0 3 >
f688cc40 1546607591 C Bi:5:009:1 0 3 = 574220
f688cc40 1546607597 S Bi:5:009:1 -115 64 <
f688cbc0 1546695951 S Bo:5:009:1 -115 64 = f000ef02 ef00ef02 ee00ee02 ed00ed02 ed00ec02 ec00eb02 eb00ea02 ea00ea02
f688cbc0 1546696607 C Bo:5:009:1 0 64 >
f688cbc0 1546696631 S Bo:5:009:1 -115 64 = e4007202 72007202 7200e302 71007102 e200e202 e100e102 70007002 e000e002
f688cbc0 1546697597 C Bo:5:009:1 0 64 >
f688cbc0 1546697609 S Bo:5:009:1 -115 64 = 6d00da02 6d006d02 d9006d02 6c00d902 6c006c02 d800d702 6c006b02 d700d602
f688cbc0 1546698592 C Bo:5:009:1 0 64 >
f688cbc0 1546698608 S Bo:5:009:1 -115 64 = d000d002 68006802 cf00cf02 67006702 67006702 67006702 cd006602 6600cc02
f688cbc0 1546699592 C Bo:5:009:1 0 64 >
f688cbc0 1546699608 S Bo:5:009:1 -115 64 = 64006402 c700c702 c600c602 c600c502 c5006202 6200c402 c300c302 c300c202
f688cbc0 1546700571 C Bo:5:009:1 0 64 >
f688cbc0 1546700598 S Bo:5:009:1 -115 64 = 5f005f02 5f005f02 bd00bd02 5e005e02 5e005e02 bb00bb02 bb00ba02 5d005d02
f688cbc0 1546701601 C Bo:5:009:1 0 64 >
f688cbc0 1546701662 S Bo:5:009:1 -115 64 = b500b502 5a005a02 5a005a02 5a005a02 b300b302 b200b202 b200b102 b100b002
f688cbc0 1546702603 C Bo:5:009:1 0 64 >
f688cbc0 1546702632 S Bo:5:009:1 -115 64 = a900a902 a900a802 a800a702 a700a702 a600a602 a500a502 a500a402 a400a302
f688cbc0 1546703599 C Bo:5:009:1 0 64 >
f688cbc0 1546703651 S Bo:5:009:1 -115 64 = 9c009c02 9c009b02 9b009a02 9a009a02 99009902 98009802 98009702 97009602
f688cbc0 1546704605 C Bo:5:009:1 0 64 >
f688cbc0 1546704631 S Bo:5:009:1 -115 28 = 8f008f02 8f008e02 8e008d02 8d008d02 8c008c02 8b008b02 8b008a02
f688cbc0 1546715604 C Bo:5:009:1 0 28 >
f688cc40 1546872605 C Bi:5:009:1 0 5 = 57423d4f 4b
f688cc40 1546872613 S Bi:5:009:1 -115 64 <
f688cbc0 1547096814 S Bo:5:009:1 -115 4 = 46072064
f688cbc0 1547097564 C Bo:5:009:1 0 4 >
f688cc40 1547099571 C Bi:5:009:1 0 3 = 464d20
f688cc40 1547099578 S Bi:5:009:1 -115 64 <

Thf688cc40 1552099611 C Bi:5:009:1 0 5 = 464d3d4f 4b
f688cc40 1552099619 S Bi:5:009:1 -115 64 <
is if688cbc0 1552545962 S Bo:5:009:1 -115 2 = 5707
f688cbc0 1552547599 C Bo:5:009:1 0 2 >
f688cc40 1552548562 C Bi:5:009:1 0 3 = 524120
f688cc40 1552548567 S Bi:5:009:1 -115 64 <
 

This is after pushing the write button.
I will now swipe the hotel card. 

f688cc40 1580246609 C Bi:5:009:1 0 5 = 52413d4f 4b
f688cc40 1580246623 S Bi:5:009:1 -115 64 <
f688cbc0 1580427928 S Bo:5:009:1 -115 2 = 4307
f688cbc0 1580428568 C Bo:5:009:1 0 2 >
f688cc40 1580430595 C Bi:5:009:1 0 3 = 435020
f688cc40 1580430601 S Bi:5:009:1 -115 64 <

It now wants to write the card.

f688cc40 1592349598 C Bi:5:009:1 0 5 = 43503d4f 4b
f688cc40 1592349609 S Bi:5:009:1 -115 64 <

It has now written the card.
f688cbc0 1602783306 S Bo:5:009:1 -115 3 = 58012e
f688cbc0 1602784605 C Bo:5:009:1 0 3 >
f688cc40 1602786597 C Bi:5:009:1 0 3 = 574220
f688cc40 1602786603 S Bi:5:009:1 -115 64 <
f688cbc0 1602990993 S Bo:5:009:1 -115 64 = f000ef02 ef00ef02 ee00ee02 ed00ed02 ed00ec02 ec00eb02 eb00ea02 ea00ea02
f688cbc0 1602991619 C Bo:5:009:1 0 64 >
f688cbc0 1602991648 S Bo:5:009:1 -115 64 = e400e402 72007202 71007102 e2007102 7100e202 e100e102 e0007002 7000e002
f688cbc0 1602992576 C Bo:5:009:1 0 64 >
f688cbc0 1602992599 S Bo:5:009:1 -115 64 = 6d006d02 da006d02 6d00d902 6c006c02 d8006c02 6c00d702 d7006b02 6b00d602
f688cbc0 1602993607 C Bo:5:009:1 0 64 >
f688cbc0 1602993656 S Bo:5:009:1 -115 64 = d000d002 d0006802 6800cf02 ce006702 67006702 67006702 6700cd02 66006602
f688cbc0 1602994612 C Bo:5:009:1 0 64 >
f688cbc0 1602994639 S Bo:5:009:1 -115 64 = c8006402 6400c702 c600c602 c600c502 c500c402 62006202 c300c302 c300c202
f688cbc0 1602995607 C Bo:5:009:1 0 64 >
f688cbc0 1602995658 S Bo:5:009:1 -115 64 = 5f005f02 5f005f02 5e00bd02 bc005e02 5e005e02 5e00bb02 bb00ba02 ba005d02
f688cbc0 1602996597 C Bo:5:009:1 0 64 >
f688cbc0 1602996657 S Bo:5:009:1 -115 64 = 5b00b502 b4005a02 5a005a02 5a005a02 5a00b302 b200b202 b200b102 b100b002
f688cbc0 1602997602 C Bo:5:009:1 0 64 >
f688cbc0 1602997652 S Bo:5:009:1 -115 64 = a900a902 a900a802 a800a702 a700a702 a600a602 a500a502 a500a402 a400a302
f688cbc0 1602998612 C Bo:5:009:1 0 64 >
f688cbc0 1602998640 S Bo:5:009:1 -115 64 = 9c009c02 9c009b02 9b009a02 9a009a02 99009902 98009802 98009702 97009602
f688cbc0 1602999606 C Bo:5:009:1 0 64 >
f688cbc0 1602999656 S Bo:5:009:1 -115 28 = 8f008f02 8f008e02 8e008d02 8d008d02 8c008c02 8b008b02 8b008a02
f688cbc0 1603010597 C Bo:5:009:1 0 28 >
f688cc40 1603167607 C Bi:5:009:1 0 5 = 57423d4f 4b
f688cc40 1603167616 S Bi:5:009:1 -115 64 <
f688cbc0 1603390754 S Bo:5:009:1 -115 4 = 46072064
f688cbc0 1603391571 C Bo:5:009:1 0 4 >
f688cc40 1603393570 C Bi:5:009:1 0 3 = 464d20
f688cc40 1603393578 S Bi:5:009:1 -115 64 <
f688cc40 1608395610 C Bi:5:009:1 0 5 = 464d3d4f 4b
f688cc40 1608395619 S Bi:5:009:1 -115 64 <
f688cbc0 1608759796 S Bo:5:009:1 -115 2 = 5707
f688cbc0 1608760604 C Bo:5:009:1 0 2 >
f688cc40 1608762569 C Bi:5:009:1 0 3 = 524120
f688cc40 1608762575 S Bi:5:009:1 -115 64 <
f688cc40 1615318615 C Bi:5:009:1 0 5 = 52413d4f 4b
f688cc40 1615318626 S Bi:5:009:1 -115 64 <
f688cbc0 1615425054 S Bo:5:009:1 -115 2 = 4307
f688cbc0 1615425572 C Bo:5:009:1 0 2 >
f688cc40 1615427568 C Bi:5:009:1 0 3 = 435020
f688cc40 1615427575 S Bi:5:009:1 -115 64 <
f688cc40 1619036614 C Bi:5:009:1 0 5 = 43503d4f 4b
f688cc40 1619036624 S Bi:5:009:1 -115 64 <

This was an attempt to walk through the same process without paying attention to the working device.
The software in question is buggy in how it is event driven.
It appears that the software sends a command and sets an internal timer, the device has no concept of time.
This means that after a time, the status window updates but it is now out of sync with the device.
So at first, it asks me to swipe a card to autoformat. If I wait too long, the status window changes and asks for a reference card. I did wait in this case. I then swiped a safeway card. I then was prompted to swipe the card for copying. I did so. The hotel card again has the safeway card information.

Tada. wheee.

Now I will save the read data into a file. I will now load from the file.
Now I will write that data again to the hotel card key with the 'write' button:
f688cbc0 1861957208 S Bo:5:009:1 -115 3 = 58012e
f688cbc0 1861958604 C Bo:5:009:1 0 3 >
f688cc40 1861960599 C Bi:5:009:1 0 3 = 574220
f688cc40 1861960605 S Bi:5:009:1 -115 64 <
f688cbc0 1862055560 S Bo:5:009:1 -115 64 = f000ef02 ef00ef02 ee00ee02 ed00ed02 ed00ec02 ec00eb02 eb00ea02 ea00ea02
f688cbc0 1862056647 C Bo:5:009:1 0 64 >
f688cbc0 1862056678 S Bo:5:009:1 -115 64 = 7200e402 e3007102 71007102 7100e202 71007102 e100e102 e000e002 70007002
f688cbc0 1862057628 C Bo:5:009:1 0 64 >
f688cbc0 1862057650 S Bo:5:009:1 -115 64 = da006d02 6d00d902 6d006c02 d9006c02 6c00d802 6c006c02 d700d702 6b006b02
f688cbc0 1862058603 C Bo:5:009:1 0 64 >
f688cbc0 1862058803 S Bo:5:009:1 -115 64 = 6800d002 d000cf02 67006702 ce00ce02 67006702 67006702 66006602 cc006602
f688cbc0 1862059629 C Bo:5:009:1 0 64 >
f688cbc0 1862060089 S Bo:5:009:1 -115 64 = 6400c702 63006302 c600c602 c600c502 c500c402 c4006202 6200c302 c300c202
f688cbc0 1862060636 C Bo:5:009:1 0 64 >
f688cbc0 1862060703 S Bo:5:009:1 -115 64 = 5f005f02 5f005e02 5e005e02 bc00bc02 5e005e02 5e005d02 bb00ba02 ba00b902
f688cbc0 1862061644 C Bo:5:009:1 0 64 >
f688cbc0 1862061661 S Bo:5:009:1 -115 64 = 5a005a02 b400b402 5a005a02 5a005a02 59005902 b200b202 b200b102 b100b002
f688cbc0 1862062639 C Bo:5:009:1 0 64 >
f688cbc0 1862062690 S Bo:5:009:1 -115 64 = a900a902 a900a802 a800a702 a700a702 a600a602 a500a502 a500a402 a400a302
f688cbc0 1862063634 C Bo:5:009:1 0 64 >
f688cbc0 1862063685 S Bo:5:009:1 -115 64 = 9c009c02 9c009b02 9b009a02 9a009a02 99009902 98009802 98009702 97009602
f688cbc0 1862064635 C Bo:5:009:1 0 64 >
f688cbc0 1862064687 S Bo:5:009:1 -115 28 = 8f008f02 8f008e02 8e008d02 8d008d02 8c008c02 8b008b02 8b008a02
f688cbc0 1862075636 C Bo:5:009:1 0 28 >
f688cc40 1862230625 C Bi:5:009:1 0 5 = 57423d4f 4b
f688cc40 1862230631 S Bi:5:009:1 -115 64 <
f688cbc0 1862456035 S Bo:5:009:1 -115 4 = 46072064
f688cbc0 1862456604 C Bo:5:009:1 0 4 >
f688cc40 1862458600 C Bi:5:009:1 0 3 = 464d20
f688cc40 1862458606 S Bi:5:009:1 -115 64 <

f688cc40 1867463606 C Bi:5:009:1 0 5 = 464d3d4f 4b
f688cc40 1867463615 S Bi:5:009:1 -115 64 <
f688cbc0 1867826049 S Bo:5:009:1 -115 2 = 5707
f688cbc0 1867827638 C Bo:5:009:1 0 2 >
f688cc40 1867828602 C Bi:5:009:1 0 3 = 524120
f688cc40 1867828608 S Bi:5:009:1 -115 64 <

This appears to now want a reference card again. Buggy!



